{
  "active_coverage_fraction": [
    [
      1.0,
      0.5,
      0.5,
      0.9999999999999999
    ],
    [
      1.0,
      0.5,
      0.5,
      1.0
    ]
  ],
  "cell_shapes_normalized": [
    [
      [
        "101",
        [
          [
            [
              0.0,
              0.0
            ],
            [
              0.75,
              1.0
            ],
            [
              1.0,
              1.0
            ],
            [
              1.0,
              0.0
            ],
            [
              0.0,
              0.0
            ]
          ]
        ]
      ],
      [
        "102",
        [
          [
            [
              0.0,
              0.0
            ],
            [
              0.0,
              1.0
            ],
            [
              0.75,
              1.0
            ],
            [
              0.0,
              0.0
            ]
          ]
        ]
      ]
    ],
    [
      [
        "101",
        [
          [
            [
              0.0,
              0.0
            ],
            [
              0.0,
              1.0
            ],
            [
              0.5,
              1.0
            ],
            [
              0.5,
              0.0
            ],
            [
              0.0,
              0.0
            ]
          ]
        ]
      ]
    ],
    [
      [
        "201",
        [
          [
            [
              0.5,
              0.0
            ],
            [
              1.0,
              0.6666666666666666
            ],
            [
              1.0,
              0.0
            ],
            [
              0.5,
              0.0
            ]
          ]
        ]
      ],
      [
        "202",
        [
          [
            [
              0.5,
              0.0
            ],
            [
              0.5,
              1.0
            ],
            [
              1.0,
              1.0
            ],
            [
              1.0,
              0.6666666666666666
            ],
            [
              0.5,
              0.0
            ]
          ]
        ]
      ]
    ],
    [
      [
        "201",
        [
          [
            [
              0.0,
              0.0
            ],
            [
              0.0,
              0.6666666666666666
            ],
            [
              0.25,
              1.0
            ],
            [
              1.0,
              1.0
            ],
            [
              1.0,
              0.0
            ],
            [
              0.0,
              0.0
            ]
          ]
        ]
      ],
      [
        "202",
        [
          [
            [
              0.0,
              0.6666666666666666
            ],
            [
              0.0,
              1.0
            ],
            [
              0.25,
              1.0
            ],
            [
              0.0,
              0.6666666666666666
            ]
          ]
        ]
      ]
    ],
    [
      [
        "101",
        [
          [
            [
              1.0,
              0.33333333333333326
            ],
            [
              1.0,
              0.0
            ],
            [
              0.75,
              0.0
            ],
            [
              1.0,
              0.33333333333333326
            ]
          ]
        ]
      ],
      [
        "102",
        [
          [
            [
              0.75,
              0.0
            ],
            [
              0.0,
              0.0
            ],
            [
              0.0,
              1.0
            ],
            [
              1.0,
              1.0
            ],
            [
              1.0,
              0.33333333333333326
            ],
            [
              0.75,
              0.0
            ]
          ]
        ]
      ]
    ],
    [
      [
        "101",
        [
          [
            [
              0.5,
              0.0
            ],
            [
              0.0,
              0.0
            ],
            [
              0.0,
              0.33333333333333326
            ],
            [
              0.5,
              1.0
            ],
            [
              0.5,
              0.0
            ]
          ]
        ]
      ],
      [
        "102",
        [
          [
            [
              0.0,
              0.33333333333333326
            ],
            [
              0.0,
              1.0
            ],
            [
              0.5,
              1.0
            ],
            [
              0.0,
              0.33333333333333326
            ]
          ]
        ]
      ]
    ],
    [
      [
        "202",
        [
          [
            [
              1.0,
              1.0
            ],
            [
              1.0,
              0.0
            ],
            [
              0.5,
              0.0
            ],
            [
              0.5,
              1.0
            ],
            [
              1.0,
              1.0
            ]
          ]
        ]
      ]
    ],
    [
      [
        "201",
        [
          [
            [
              1.0,
              0.0
            ],
            [
              0.25,
              0.0
            ],
            [
              1.0,
              1.0
            ],
            [
              1.0,
              0.0
            ]
          ]
        ]
      ],
      [
        "202",
        [
          [
            [
              0.25,
              0.0
            ],
            [
              0.0,
              0.0
            ],
            [
              0.0,
              1.0
            ],
            [
              1.0,
              1.0
            ],
            [
              0.25,
              0.0
            ]
          ]
        ]
      ]
    ]
  ],
  "coordinate_system": "EPSG:32650",
  "display_is_derived": true,
  "dx": 1.0,
  "dy": 1.0,
  "format": "hydrodynamics-legacy-grid-compatibility-v1",
  "grid_id_digest": "3bf46756821bc305673812821548a949af9428e5e16c6b5c0e866f06da7e1a21",
  "id_rule": "1-based row-major: row*nx+col+1",
  "mapping": {
    "format": "hydrodynamics-legacy-grid-compatibility-v1",
    "native_result_sha256": "60527630ae2ba890bede53190f359c32ca17478062941cdecf30d418a8561cc4",
    "cell_size_m": 1.0,
    "origin_lower_left_m": [
      0.0,
      0.0
    ],
    "shape_ny_nx": [
      2,
      4
    ],
    "id_rule": "1-based row-major: row*nx+col+1",
    "coverage_area_m2": 6.0,
    "native_active_area_m2": 6.0,
    "face_overlap_rule": "exact planar native triangle ∩ display cell area in source projected CRS",
    "source_covered_area_m2": [
      [
        1.0,
        0.5,
        0.5,
        0.9999999999999999
      ],
      [
        1.0,
        0.5,
        0.5,
        1.0
      ]
    ],
    "wet_area_semantics": "native wet_area uses the native face dry threshold; compatibility display wet-covered area sums source_covered_area_m2 where mapped display depth is strictly positive",
    "display_area_semantics": "dx*dy is the source-CRS display-cell area and is not substituted for source overlap area after reprojection",
    "partial_cell_rule": "store covered-area mean and active_coverage_fraction; never pad uncovered area with zero",
    "field_rule": "area-average h and per-width momentum over covered area; recover u/v as mean(momentum)/mean(h) for wet cells",
    "cell_contributions": [
      [
        [
          "101",
          0.625
        ],
        [
          "102",
          0.375
        ]
      ],
      [
        [
          "101",
          0.5
        ]
      ],
      [
        [
          "201",
          0.16666666666666666
        ],
        [
          "202",
          0.33333333333333337
        ]
      ],
      [
        [
          "201",
          0.9583333333333333
        ],
        [
          "202",
          0.04166666666666667
        ]
      ],
      [
        [
          "101",
          0.04166666666666666
        ],
        [
          "102",
          0.9583333333333334
        ]
      ],
      [
        [
          "101",
          0.3333333333333333
        ],
        [
          "102",
          0.16666666666666669
        ]
      ],
      [
        [
          "202",
          0.5
        ]
      ],
      [
        [
          "201",
          0.375
        ],
        [
          "202",
          0.625
        ]
      ]
    ],
    "cell_shapes_normalized": [
      [
        [
          "101",
          [
            [
              [
                0.0,
                0.0
              ],
              [
                0.75,
                1.0
              ],
              [
                1.0,
                1.0
              ],
              [
                1.0,
                0.0
              ],
              [
                0.0,
                0.0
              ]
            ]
          ]
        ],
        [
          "102",
          [
            [
              [
                0.0,
                0.0
              ],
              [
                0.0,
                1.0
              ],
              [
                0.75,
                1.0
              ],
              [
                0.0,
                0.0
              ]
            ]
          ]
        ]
      ],
      [
        [
          "101",
          [
            [
              [
                0.0,
                0.0
              ],
              [
                0.0,
                1.0
              ],
              [
                0.5,
                1.0
              ],
              [
                0.5,
                0.0
              ],
              [
                0.0,
                0.0
              ]
            ]
          ]
        ]
      ],
      [
        [
          "201",
          [
            [
              [
                0.5,
                0.0
              ],
              [